{
  "schema_version": 1,
  "dataset_id": "minimal-test-network",
  "coordinate_system": {
    "units": "m",
    "axis_convention": "x_forward_y_right_z_up",
    "origin_description": "Local engineering origin for GeoForge unit fixture"
  },
  "nodes": [
    {
      "id": "node-a",
      "x_m": 0.0,
      "y_m": 0.0,
      "z_m": 0.0
    },
    {
      "id": "node-b",
      "x_m": 100.0,
      "y_m": 0.0,
      "z_m": 1.0
    }
  ],
  "segments": [
    {
      "id": "segment-1",
      "start_node_id": "node-a",
      "end_node_id": "node-b",
      "road_class": "secondary",
      "speed_limit_mps": 13.8888888889,
      "lane_ids": [
        "lane-1-forward",
        "lane-1-backward"
      ],
      "centerline": [
        [0.0, 0.0, 0.0],
        [50.0, 0.0, 0.5],
        [100.0, 0.0, 1.0]
      ]
    }
  ],
  "lanes": [
    {
      "id": "lane-1-forward",
      "segment_id": "segment-1",
      "direction": "forward",
      "width_m": 3.25,
      "centerline": [
        [0.0, 1.625, 0.0],
        [50.0, 1.625, 0.5],
        [100.0, 1.625, 1.0]
      ]
    },
    {
      "id": "lane-1-backward",
      "segment_id": "segment-1",
      "direction": "backward",
      "width_m": 3.25,
      "centerline": [
        [100.0, -1.625, 1.0],
        [50.0, -1.625, 0.5],
        [0.0, -1.625, 0.0]
      ]
    }
  ],
  "surface_zones": [
    {
      "id": "surface-asphalt-1",
      "material_id": "asphalt_fresh",
      "dry_friction_baseline": 1.0,
      "wet_friction_baseline": 0.72,
      "drainage01": 0.75,
      "segment_ids": [
        "segment-1"
      ],
      "roughness": 0.15,
      "macrotexture": 0.60,
      "temperature_c": 20.0
    }
  ]
}
